<?xml version="1.0" encoding="UTF-8"?>
<book xmlns:xsi="http://www.w3.org/2001/XMLSchema-instance"
      xsi:noNamespaceSchemaLocation="book.xsd">

    <isbn>9781846282522</isbn>
    <title>Fundamental Networking in Java</title>
    <person>
        <first_name>Pitt</first_name>
        <last_name>Esmond</last_name>
    </person>
    <publisher>Apress</publisher>
    <page_number>382</page_number>
    <description>The book provides complete coverage of fundamental IP networking in Java</description>
    <papper/>

</book>
